{
  "authority": {
    "allowed_action_authority": "none",
    "control_intent_contract": null,
    "spo_actionable": false,
    "spo_semantic_mode": "review_only"
  },
  "capabilities": [
    {
      "evidence_maturity": "computational_prototype",
      "evidence_pointer": "VALIDATION.md#device-configuration-model",
      "identifier": "device_configuration_model"
    },
    {
      "evidence_maturity": "computational_prototype",
      "evidence_pointer": "VALIDATION.md#diagnostic-and-clock-semantics",
      "identifier": "diagnostic_clock_semantics"
    },
    {
      "evidence_maturity": "computational_prototype",
      "evidence_pointer": "VALIDATION.md#level-0-device-physics",
      "identifier": "level0_device_physics"
    },
    {
      "evidence_maturity": "computational_prototype",
      "evidence_pointer": "VALIDATION.md#device-3d-model",
      "identifier": "device_3d_model"
    },
    {
      "evidence_maturity": "computational_prototype",
      "evidence_pointer": "VALIDATION.md#device-cad-model",
      "identifier": "device_cad_model"
    }
  ],
  "configurations": [
    "sheared_flow_z_pinch",
    "z_pinch"
  ],
  "confinement_family": "self_magnetic",
  "control_adapter": {
    "contract_version": "0.1.0-spec",
    "identifier": "scpn-z-pinch-core.control-adapter"
  },
  "device_family": "z_pinch",
  "evidence_maturity": "computational_prototype",
  "lifecycle": {
    "evidence_pointer": null,
    "reason": "federation gates have not run; capabilities remain repository-local",
    "state": "not_federated"
  },
  "machine_protection": {
    "availability": "not_assessed",
    "final_veto_owner": "independent_machine_protection"
  },
  "non_claims": [
    "not machine-ready",
    "not safety-certified",
    "not autonomous-plant-ready",
    "not commercially reactor-ready",
    "no implemented solver, controller, dataset, or published artefact; the level-0 analytic device models, the analytic-surface device 3D model, the B-rep CAD model of the same design (built by the pinned third-party OpenCASCADE kernel, checked against the analytic closed forms, STEP deterministic only within the pinned back-end environment) and their timing benchmarks are computational prototypes, not validated performance, confinement or engineering claims",
    "no experimental correlation",
    "no parameter set describes or validates any real machine"
  ],
  "project": "SCPN-Z-PINCH-CORE",
  "research_group": {
    "coordination_identity": "SCPN-REACTOR-SYSTEMS",
    "display_name": "SCPN Reactor Systems Research Group"
  },
  "schema": "scpn.studio-portfolio-descriptor.v1",
  "schema_version": "1.1.0",
  "source": {
    "manifest_path": "reactor-domain.json",
    "manifest_schema": "scpn.reactor-domain.v1",
    "manifest_schema_version": "1.0.0",
    "manifest_sha256": "18f6bea82a215fdc1b8c56ba52d9e3a9accb65d5f65b00c167c86f73f3f799a1",
    "repository": "SCPN-Z-PINCH-CORE"
  },
  "spo_registry": {
    "digest_sha256": "786d9542ce76c56dd7748fa948b17efed6c073525e527ce90e6d5e29a2d00090",
    "version": "1.0.0"
  }
}
